{
 "req_id": "SIM-P05-R001",
 "artefacto": "user_story_set",
 "agente_evaluado": "product-analyst-agent",
 "veredicto": "rechazado",
 "hallazgos": [
  {
   "severidad": "bloqueante",
   "regla": "F5.gwt_ratio",
   "detalle": "criterio no observable: given/when/then genéricos",
   "ubicacion": "historias[1].criterios[0]"
  },
  {
   "severidad": "bloqueante",
   "regla": "F5.br_coverage",
   "detalle": "BR-011 referenciada en el brief no aparece en ninguna historia",
   "ubicacion": "historias[1].reglas_negocio"
  }
 ],
 "politicas_aplicadas": [
  "F5.schema_valid",
  "F5.gwt_ratio",
  "F5.br_coverage",
  "POL:seguridad"
 ],
 "requiere_humano": false,
 "provenance": {
  "contract_version": "1.0",
  "req_id": "SIM-P05-R001",
  "agent": "governance-agent",
  "phase": "discovery",
  "inputs": [
   "user_story_set"
  ],
  "knowledge_refs": [
   "BR-010",
   "BR-011",
   "POL:seguridad"
  ],
  "assumptions": []
 }
}